{
  "schema": "tiangong.supabase-consumer-manifest.v3",
  "version": 3,
  "repository": "linancn/tiangong-lca-mcp",
  "sourceTreeCommit": "06a856b3910b198b59170fd2bf1b5d420576777b",
  "authority": {
    "status": "candidate",
    "authorizesDatabaseFreeze": false,
    "authorizesDatabaseMigration": false,
    "authorizesHostedMutation": false,
    "authorizesMergeOrDeploy": false
  },
  "source": {
    "derivation": "typescript-compiler-ast-and-json-parser-v1",
    "governedPatterns": [
      "src/**/*.{ts,tsx,js,mjs,cjs}",
      "scripts/**/*.{ts,tsx,js,mjs,cjs}",
      "package.json"
    ],
    "exactExemptions": [
      "scripts/ci/scan-data-api-consumers.ts"
    ],
    "treeDigestAlgorithm": "sha256(mode\\0path\\0blobOid\\0)",
    "treeDigest": "5bada8ead71b940e9286779044317e65397b5b13d458158f99a1a51ab948c10f",
    "fileCount": 32
  },
  "capabilities": [
    {
      "id": "mcp-tool:Database_CRUD_Tool",
      "kind": "mcp-tool",
      "name": "Database_CRUD_Tool",
      "registrationFile": "src/tools/db_crud.ts",
      "runtimeTransports": [
        "streamable-http"
      ]
    },
    {
      "id": "mcp-tool:Search_Flows_Tool",
      "kind": "mcp-tool",
      "name": "Search_Flows_Tool",
      "registrationFile": "src/tools/flow_hybrid_search.ts",
      "runtimeTransports": [
        "stdio",
        "streamable-http"
      ]
    },
    {
      "id": "mcp-tool:Search_Life_Cycle_Models_Tool",
      "kind": "mcp-tool",
      "name": "Search_Life_Cycle_Models_Tool",
      "registrationFile": "src/tools/life_cycle_model_hybrid_search.ts",
      "runtimeTransports": [
        "stdio",
        "streamable-http"
      ]
    },
    {
      "id": "mcp-tool:Search_Processes_Tool",
      "kind": "mcp-tool",
      "name": "Search_Processes_Tool",
      "registrationFile": "src/tools/process_hybrid_search.ts",
      "runtimeTransports": [
        "stdio",
        "streamable-http"
      ]
    },
    {
      "id": "transport:http-authentication",
      "kind": "transport-auth",
      "name": "authenticated POST /mcp lifecycle",
      "registrationFile": "src/index_server.ts",
      "runtimeTransports": [
        "streamable-http"
      ]
    }
  ],
  "occurrences": [
    {
      "id": "mcp-5c22a0248a317c9d2d005ddc",
      "file": "src/_shared/auth_middleware.ts",
      "line": 11,
      "span": {
        "startOffset": 526,
        "endOffset": 583,
        "startLine": 11,
        "startColumn": 18,
        "endLine": 11,
        "endColumn": 75,
        "sha256": "41261e36ab8b27f270b6fd9cd1b7e0ee811f23ccd87434b0a4cdf7b91bb32184"
      },
      "capability": "transport:http-authentication",
      "operation": "client.create",
      "transport": "auth",
      "credential": "publishable-key-plus-api-key-or-user-bearer",
      "schema": "client",
      "object": "supabase-project",
      "signature": "createClient(supabase_base_url, supabase_publishable_key)",
      "acl": "Supabase Auth validates password or bearer; authenticated role required",
      "semantics": "HTTP MCP authentication lifecycle; Redis cache may reuse unexpired session",
      "upstream": [
        "tiangong-lca/database-engine#357",
        "tiangong-lca/workspace#484"
      ],
      "sourceClass": "typescript-ast"
    },
    {
      "id": "mcp-f8afc62ea5d0d0e901577add",
      "file": "src/_shared/auth_middleware.ts",
      "line": 198,
      "span": {
        "startOffset": 5465,
        "endOffset": 5535,
        "startLine": 198,
        "startColumn": 35,
        "endLine": 201,
        "endColumn": 7,
        "sha256": "005a78d95986832923b3f7369e0aa8b446ca6ee22607859c0dd09ce969953332"
      },
      "capability": "transport:http-authentication",
      "operation": "auth.signInWithPassword",
      "transport": "auth",
      "credential": "publishable-key-plus-api-key-or-user-bearer",
      "schema": "auth",
      "object": "signInWithPassword",
      "signature": "supabase.auth.signInWithPassword({\n      email,\n      password,\n    })",
      "acl": "Supabase Auth validates password or bearer; authenticated role required",
      "semantics": "HTTP MCP authentication lifecycle; Redis cache may reuse unexpired session",
      "upstream": [
        "tiangong-lca/database-engine#357",
        "tiangong-lca/workspace#484"
      ],
      "sourceClass": "typescript-ast"
    },
    {
      "id": "mcp-a942e7fb874eae3b9440f647",
      "file": "src/_shared/auth_middleware.ts",
      "line": 252,
      "span": {
        "startOffset": 6872,
        "endOffset": 6904,
        "startLine": 252,
        "startColumn": 36,
        "endLine": 252,
        "endColumn": 68,
        "sha256": "8eb656e9f39b37ccdaf83a7d5d7a7ef2a0585d93c2747b270b8739005bfbc56a"
      },
      "capability": "transport:http-authentication",
      "operation": "auth.getUser",
      "transport": "auth",
      "credential": "publishable-key-plus-api-key-or-user-bearer",
      "schema": "auth",
      "object": "getUser",
      "signature": "supabase.auth.getUser(bearerKey)",
      "acl": "Supabase Auth validates password or bearer; authenticated role required",
      "semantics": "HTTP MCP authentication lifecycle; Redis cache may reuse unexpired session",
      "upstream": [
        "tiangong-lca/database-engine#357",
        "tiangong-lca/workspace#484"
      ],
      "sourceClass": "typescript-ast"
    },
    {
      "id": "mcp-608d3b712ef9242c428670ca",
      "file": "src/tools/db_crud.ts",
      "line": 317,
      "span": {
        "startOffset": 10388,
        "endOffset": 10786,
        "startLine": 317,
        "startColumn": 20,
        "endLine": 334,
        "endColumn": 5,
        "sha256": "074a8902ff4cfa0e6a7c876c7e94c7c1b59ef6b65a3abe08e0609ee2335626a6"
      },
      "capability": "mcp-tool:Database_CRUD_Tool",
      "operation": "client.create",
      "transport": "auth",
      "credential": "publishable-key-plus-api-key-or-user-bearer",
      "schema": "client",
      "object": "supabase-project",
      "signature": "createClient(supabase_base_url, supabase_publishable_key, {\n    db: {\n      schema: 'public',\n    },\n    auth: {\n      persistSession: false,\n      autoRefreshToken: Boolean(normalizedSession?.refresh_token),\n    },\n    ...(bearerToken\n      ? {\n          global: {\n            headers: {\n              Authorization: `Bearer ${bearerToken}`,\n            },\n          },\n        }\n      : {}),\n  })",
      "acl": "Supabase Auth validates password or bearer; authenticated role required",
      "semantics": "HTTP MCP authentication lifecycle; Redis cache may reuse unexpired session",
      "upstream": [
        "tiangong-lca/database-engine#357",
        "tiangong-lca/workspace#484"
      ],
      "sourceClass": "typescript-ast"
    },
    {
      "id": "mcp-eb67792651d7ec55249a7862",
      "file": "src/tools/db_crud.ts",
      "line": 337,
      "span": {
        "startOffset": 10876,
        "endOffset": 11015,
        "startLine": 337,
        "startColumn": 46,
        "endLine": 340,
        "endColumn": 7,
        "sha256": "064930a3006941392a9f804816ef0191a7951c60c32f143c0c379d6a2a4e9c61"
      },
      "capability": "mcp-tool:Database_CRUD_Tool",
      "operation": "auth.setSession",
      "transport": "auth",
      "credential": "publishable-key-plus-api-key-or-user-bearer",
      "schema": "auth",
      "object": "setSession",
      "signature": "supabase.auth.setSession({\n      access_token: normalizedSession.access_token,\n      refresh_token: normalizedSession.refresh_token,\n    })",
      "acl": "Supabase Auth validates password or bearer; authenticated role required",
      "semantics": "optional SDK refresh-token session installation",
      "upstream": [
        "tiangong-lca/database-engine#357",
        "tiangong-lca/workspace#484"
      ],
      "sourceClass": "typescript-ast"
    },
    {
      "id": "mcp-865ab23b65376e43819cf3a0",
      "file": "src/tools/db_crud.ts",
      "line": 354,
      "span": {
        "startOffset": 11544,
        "endOffset": 11564,
        "startLine": 354,
        "startColumn": 22,
        "endLine": 354,
        "endColumn": 42,
        "sha256": "e460856d337a4e6f38b3975180c4c7bf7d92a4a4363f73864891209ba136332f"
      },
      "capability": "mcp-tool:Database_CRUD_Tool",
      "operation": "select",
      "transport": "postgrest",
      "credential": "publishable-key-plus-optional-user-session",
      "schema": "public",
      "object": "contacts",
      "signature": "public.contacts.select",
      "acl": "public relation grants and RLS; optional authenticated bearer forwarded",
      "semantics": "read; optional filters/limit; no completeness guarantee",
      "upstream": [
        "tiangong-lca/database-engine#357",
        "tiangong-lca/workspace#484"
      ],
      "sourceClass": "typescript-ast"
    },
    {
      "id": "mcp-80ce3b49106e4f491df9b0fa",
      "file": "src/tools/db_crud.ts",
      "line": 354,
      "span": {
        "startOffset": 11544,
        "endOffset": 11564,
        "startLine": 354,
        "startColumn": 22,
        "endLine": 354,
        "endColumn": 42,
        "sha256": "e460856d337a4e6f38b3975180c4c7bf7d92a4a4363f73864891209ba136332f"
      },
      "capability": "mcp-tool:Database_CRUD_Tool",
      "operation": "select",
      "transport": "postgrest",
      "credential": "publishable-key-plus-optional-user-session",
      "schema": "public",
      "object": "flows",
      "signature": "public.flows.select",
      "acl": "public relation grants and RLS; optional authenticated bearer forwarded",
      "semantics": "read; optional filters/limit; no completeness guarantee",
      "upstream": [
        "tiangong-lca/database-engine#357",
        "tiangong-lca/workspace#484"
      ],
      "sourceClass": "typescript-ast"
    },
    {
      "id": "mcp-a95599f04028d6b0cda6bbca",
      "file": "src/tools/db_crud.ts",
      "line": 354,
      "span": {
        "startOffset": 11544,
        "endOffset": 11564,
        "startLine": 354,
        "startColumn": 22,